Description,MetaData,Title
"Tìm hiểu thông tin về tư vấn viên, không chuyển tiền vào tài khoản cá nhân... là những điều khách hàng cần lưu ý khi tham gia hợp đồng bảo hiểm.",not yet,Lưu ý khi làm việc với chuyên viên tư vấn bảo hiểm
"Đại đô thị Meyhomes Capital Phú Quốc của Tân Á Đại Thành sẽ triển khai khu ""phố Hàn Quốc"" theo đề xuất giải pháp công nghệ của Daewoo E&C.",not yet,Tân Á Đại Thành hợp tác với Daewoo E&C tại dự án Phú Quốc
"Các doanh nghiệp nhỏ và vừa (SME) sẽ được hỗ trợ tư vấn, kỹ thuật và tài chính trong việc ứng dụng giải pháp công nghệ để tăng năng suất lao động.",not yet,Cơ hội nhận gói tăng năng suất miễn phí cho doanh nghiệp
"Tình trạng thiếu hụt nguồn cung hàng hóa và chi phí vận chuyển tăng cao, thị trường bán lẻ đang bấp bênh trước dịp nghỉ lễ cuối năm.",not yet,Logistics không đáp ứng được nhu cầu tiêu dùng trước dịp lễ
"Các doanh nghiệp sản xuất thép trở thành điểm sáng của chứng khoán trong phiên đầu tuần, trong khi nhóm ngân hàng tiếp tục bị bán tháo.",not yet,Cổ phiếu thép tăng mạnh
"Thương mại toàn cầu vẫn là một mớ hỗn độn, chi phí vận chuyển tiếp tục gia tăng khi mùa mua sắm Giáng Sinh đến gần.",not yet,Chuỗi cung ứng toàn cầu hỗn loạn trước mùa mua sắm cuối năm
Đại diện Thương mại Mỹ Katherine Tai sẽ thảo luận với Phó thủ tướng Trung Quốc Lưu Hạc qua điện thoại trong vài ngày tới.,not yet,Mỹ - Trung sắp nối lại đàm phán thương mại
"Với lợi thế mức giá hợp lý, nhiều dư địa tăng trưởng, những thị trường mới nổi ven biển phía Nam đang được giới đầu tư quan tâm.",not yet,Xung lực của bất động sản ven biển phía Nam sau Covid-19
"Home Credit được The Global Economics vinh danh ""Công ty tài chính tiêu dùng quốc tế tốt nhất"" và ""Tiên phong trong chiến lược sáng tạo chuyển đổi kỹ thuật số"".",not yet,Home Credit nhận hai giải thưởng quốc tế về tài chính tiêu dùng
"Chưa đến 20% top mặt hàng được tìm mua trên sàn thương mại điện tử là hàng Việt Nam, theo khảo sát của iPrice.",not yet,Hàng Việt lép vế trên các sàn thương mại điện tử
"Bảo vệ ung thư giai đoạn sau tới 80 tuổi là một trong những quyền lợi nổi bật của gói sản phẩm ""FWD Đón đầu thay đổi 3.0"".",not yet,FWD ra mắt sản phẩm có quyền lợi bảo vệ đến 80 tuổi
"Là nạn nhân trong vụ cháy kho xưởng thiệt hại hàng chục triệu USD, bà Phạm Thị Bích Huệ hy vọng Luật Kinh doanh bảo hiểm sớm được sửa đổi để bảo vệ lợi ích cho người mua.",not yet,Doanh nghiệp mong chờ luật bảo hiểm sớm sửa đổi
"Nhu cầu lớn, nguồn cung tương lai tại các khu vực xa trung tâm mở rộng khiến thị trường căn hộ Hà Nội được dự báo phục hồi tốt.",not yet,Savills: Thị trường căn hộ sẽ phục hồi tốt sau dịch bệnh
"Vhome Expo được tổ chức hàng tháng, sẽ mang tới thông tin hữu ích về thị trường và sản phẩm bất động sản hấp dẫn theo chủ đề.",not yet,Ra mắt Vhome Expo - hội chợ bất động sản online định kỳ
"Tâm điểm giao thương, phong cách sống ""trên bên dưới thuyền"" thời thượng… giúp Sun Harbor 1 tại Aqua City được lòng nhà đầu tư và giới tinh hoa yêu thích.",not yet,Hấp lực Sun Harbor 1 dưới góc nhìn đầu tư và phong cách sống
"Cát Vạn Lợi sản xuất, cung cấp hệ thống chống sét tiếp địa, băng nhôm thoát sét 25x3m, có giá thành rẻ, tải trọng nhẹ.",not yet,Băng nhôm chống sét tiếp địa Cát Vạn Lợi giúp tiết kiệm chi phí
"Nhiều tiểu thương trên địa bàn TP HCM nhận được gói hỗ trợ 5 triệu đồng từ chương trình ""Góp triệu ngôi sao"".",not yet,600 tiểu thương nhận gói hỗ trợ 5 triệu đồng
"Hạ tầng đồng bộ, nhiều dự án quy mô đưa Phan Thiết vào tầm ngắm của giới đầu tư, đặc biệt là các sản phẩm second home đón tiềm năng du lịch nghỉ dưỡng.",not yet,Triển vọng đầu tư second home biển Phan Thiết
"Đại dịch khiến kinh tế khó khăn, thất nghiệp gia tăng, nhưng có những ngành, nhân sự vẫn được săn đón quyết liệt.",not yet,Thời cơ của nhân lực ngành công nghệ
Ông Trần Cao Châu từ chức tổng giám đốc kiêm người đại diện pháp luật của Công ty cổ phần Tập đoàn Đức Long Gia Lai từ 1/10.,not yet,Tổng giám đốc Đức Long Gia Lai từ chức
"Công ty bất động sản tham vọng tăng trưởng lợi nhuận trước thuế trung bình 51%, tổng lợi nhuận tích lũy đạt 14.270 tỷ đồng, trong giai đoạn 2019-2023.",not yet,Phát Đạt đặt mục tiêu tăng trưởng hàng năm 51%
Cán bộ nhân viên các công ty thuộc Phú Mỹ Hưng Asia Holdings và cư dân tại đây tham gia hiến máu ngay sau khi thành phố nới lỏng giãn cách xã hội.,not yet,Nhân viên và cư dân Phú Mỹ Hưng hiến máu sau giãn cách
"OCB vừa tổ chức quay số trực tuyến tìm ra 55 khách hàng trúng giải ""Ngàn ưu đãi - triệu tri ân"", 7 chủ nhân giải ""Lươt OMNI, Free Macbook"".",not yet,OCB tìm ra người trúng thưởng chương trình kỷ niệm 25 năm
"Giao đoạn vé siêu sớm 159.000 đồng cho Toạ đàm chia sẻ cách tạo thu nhập thụ động sẽ kết thúc vào 23h59 ngày 4/10, trước khi chuyển giá 219.000 đồng.",not yet,Ngày cuối bán vé siêu sớm eBox chuyên đề thu nhập thụ động
D’. Metropole Hà Tĩnh mang đến không gian sống Home resort (nghỉ dưỡng tại nhà) với đa dạng hệ thống tiện ích và cảnh quan nội khu.,not yet,Tân Hoàng Minh đưa phong cách nghỉ dưỡng tại gia vào dự án mới
MSB vừa được ADB vinh danh “Ngân hàng dẫn đầu về tài trợ thương mại cho doanh nghiệp vừa và nhỏ năm 2021”.,not yet,MSB nhận giải thưởng quốc tế về tài trợ thương mại
"Giải thưởng Chất lượng quốc tế Châu Á - Thái Bình Dương 2021 vinh danh TH, đơn vị sở hữu thương hiệu TH true Milk ở hạng mục cao nhất cho loại hình sản xuất lớn.",not yet,TH đạt hạng mục cao nhất ở Giải thưởng Chất lượng quốc tế
Việc đốc thúc giải ngân nguồn vốn đầu tư công cho các công trình hạ tầng được giới đầu tư kỳ vọng sẽ là đòn bẩy cho thị trường bất động sản.,not yet,Bất động sản Bà Rịa - Vũng Tàu đón đầu các dự án hạ tầng lớn
"Ông Trần Ngọc Chính, Chủ tịch Hội Quy hoạch Phát triển đô thị Việt Nam đánh giá, khi sông Đơ được cải tạo và hình thành khu đô thị hiện đại, Sầm Sơn sẽ thêm lợi thế thu hút du khách hạng sang.",not yet,'Sầm Sơn sẽ cất cánh khi sông Đơ được hồi sinh'
